{
  "id": "commerce-saas.admin-ui-sdk",
  "label": "Admin UI SDK extension",
  "class": "C",
  "pack": "commerce-saas",
  "applicability": "both",
  "detect": "app.config.yaml",
  "provisioning": {
    "label": "Admin UI SDK",
    "check": "doc",
    "help": "Install the Adobe Commerce Admin UI SDK module in the Commerce instance. https://developer.adobe.com/commerce/extensibility/admin-ui-sdk/"
  },
  "fields": [
    { "id": "menuName", "label": "Admin menu label", "type": "text", "default": "My Extension" },
    { "id": "routePath", "label": "Route path", "type": "text", "validate": "kebab", "default": "my-extension" }
  ],
  "files": [
    { "path": "src/commerce-backend-ui-1/web/${routePath}/index.html", "template": "page.html" },
    { "path": "extension-manifest.json", "template": "manifest.json", "merge": true }
  ],
  "postNote": "Admin UI SDK renders this App Builder UI inside the Commerce admin. Declare required ACL resources (commerce-saas/admin-ext-permissions). Run `aio app dev` to preview."
}
